{
  "$schema": "../../schema/module.schema.json",
  "schemaVersion": 1,
  "id": "feature-memory",
  "description": "A MEMORY.md per feature, a mistakes log, memory hooks and the /new-feature and /handoff skills.",
  "presets": ["small", "medium", "full"],
  "requires": ["base"],
  "files": [
    {
      "from": "memory-template.md",
      "to": "docs/features/_template/MEMORY.md",
      "strategy": "create-only",
      "target": "project"
    },
    { "from": "mistakes.md", "to": "docs/mistakes.md", "strategy": "create-only", "target": "project" },
    {
      "from": "skill-new-feature.md",
      "to": ".claude/skills/new-feature/SKILL.md",
      "strategy": "owned",
      "target": "project"
    },
    {
      "from": "skill-handoff.md",
      "to": ".claude/skills/handoff/SKILL.md",
      "strategy": "owned",
      "target": "project"
    },
    { "to": ".claude/settings.json", "strategy": "json", "target": "project" },
    { "to": "AGENTS.md", "strategy": "blocks", "target": "project" }
  ],
  "blocks": [{ "file": "AGENTS.md", "id": "feature-memory", "template": "agents-feature-memory.md" }],
  "hooks": [
    {
      "event": "SessionStart",
      "matcher": "startup|resume|clear|compact",
      "script": "dist/hooks/session-start.mjs",
      "timeout": 10
    },
    { "event": "PreCompact", "script": "dist/hooks/pre-compact.mjs", "timeout": 10 },
    { "event": "Stop", "script": "dist/hooks/memory-stop.mjs", "timeout": 10 }
  ],
  "internal": true
}
